{
  "_documentation": {
    "tierSemantics": "pr: fail-fast gate. nightly_fast: nightly without env-gated staging legs. nightly_deep: nightly + heavy meta checks. pr_maximal_dev: same gates as pr_strict for qa-maximal-sweep branch experiments. release_ultimate: release tier with report steps marked required under REPORT_GATE_STRICT. checks_batch_strict: autodiscover with empty denylist (shard via QA_CHECK_BATCH_*). ifEnv steps use required:true so QA_ULTIMATE_STRICT=1 fails when env is unset; without strict they are skipped when env is unset.",
    "batching": "mergeAutodiscoverChecks appends discovered npm check:* after explicit steps (minus denylist, minus duplicates). QA_CHECK_BATCH_TOTAL (aliases QA_CHECK_BATCH_SIZE, QA_CHECK_BATCH_COUNT) and QA_CHECK_BATCH_INDEX (1-based) shard the discovered set via stable hash. QA_ULTIMATE_STRICT=1 fails when a step has ifEnv + required true and the env is unset. For QA_MAXIMAL_DISCOVER_CHECK_UNION=1, scripts/run-qa-discovered-checks-union.mjs accepts the same QA_CHECK_BATCH_* totals as QA_MAXIMAL_DISCOVER_BATCH_* (see script header)."
  },
  "version": 1,
  "autodiscover": {
    "denylist": []
  },
  "tiers": {
    "pr": {
      "mergeAutodiscoverChecks": false,
      "steps": [
        "report:qa-coverage-tier",
        "qa:sweep:max:p4",
        "pipeline:ci-parity",
        "check:command-reference-integrity",
        "license:allowlist-verify",
        "verify:ofac-sample-hash",
        "check:openapi-route-coverage",
        "check:control-traceability"
      ]
    },
    "pr_strict": {
      "mergeAutodiscoverChecks": false,
      "steps": [
        { "script": "report:qa-coverage-tier", "required": true },
        { "script": "qa:sweep:max:p4", "required": true },
        { "script": "pipeline:ci-parity", "required": true },
        { "script": "check:command-reference-integrity", "required": true },
        { "script": "license:allowlist-verify", "required": true },
        { "script": "verify:ofac-sample-hash:strict", "required": true },
        { "script": "check:openapi-route-coverage", "required": true },
        { "script": "check:control-traceability:strict", "required": true },
        { "script": "check:e2e-quarantine:strict", "required": true },
        { "script": "check:src-tree-coverage", "required": true },
        { "script": "check:pr-body-json", "required": true }
      ]
    },
    "pr_maximal_dev": {
      "mergeAutodiscoverChecks": false,
      "steps": [
        { "script": "report:qa-coverage-tier", "required": true },
        { "script": "qa:sweep:max:p4", "required": true },
        { "script": "pipeline:ci-parity", "required": true },
        { "script": "check:command-reference-integrity", "required": true },
        { "script": "license:allowlist-verify", "required": true },
        { "script": "verify:ofac-sample-hash:strict", "required": true },
        { "script": "check:openapi-route-coverage", "required": true },
        { "script": "check:control-traceability:strict", "required": true },
        { "script": "check:e2e-quarantine:strict", "required": true },
        { "script": "check:src-tree-coverage", "required": true },
        { "script": "check:pr-body-json", "required": true }
      ]
    },
    "nightly_fast": {
      "mergeAutodiscoverChecks": false,
      "steps": [
        "report:qa-coverage-tier",
        "qa:sweep:max:p4",
        "pipeline:ci-parity",
        "check:command-reference-integrity",
        "license:allowlist-verify",
        "verify:ofac-sample-hash",
        "check:qa-workflow-fleet",
        "check:next-config-surface",
        "check:dependabot-config",
        "check:vercel-cron",
        "check:env-matrix",
        "check:e2e-env-matrix",
        "check:merge-queue-canary-parity",
        "check:artifact-json-matrix",
        "check:artifact-integrity",
        "check:e2e-po-route-coverage",
        "check:qa-injection-class-matrix",
        "check:jurisdiction-artifact-coverage",
        "check:absent-protocol-evidence",
        "check:ofac-screening-stub-parity",
        "check:robots-crawler-policy",
        "check:reporting-endpoints",
        "check:pen-test-findings-closure",
        "check:subprocessor-change-sla",
        "check:src-tree-coverage",
        "check:pr-body-json",
        "check:api-problem-json",
        "check:api-sunset-deprecation",
        "check:sharp-svgo-versions",
        "check:suppress-hydration-warning",
        "check:kyb-beneficial-owner-schema",
        "check:rebuild-v10-read-models-nightly-gate",
        "check:eslint-custom-rules-optional",
        "test:scripts",
        "test:integration:ai-webhook",
        "security:sweep:comprehensive",
        "perf:sweep:quarterly",
        "test:e2e:ui-qa-plan",
        "test:e2e:adversarial",
        "test:e2e:resilience:all",
        "test:vitest:v10",
        "report:test-heatmap"
      ]
    },
    "nightly": {
      "mergeAutodiscoverChecks": false,
      "steps": [
        "report:qa-coverage-tier",
        "qa:sweep:max:p4",
        "pipeline:ci-parity",
        "check:command-reference-integrity",
        "license:allowlist-verify",
        "verify:ofac-sample-hash",
        "check:qa-workflow-fleet",
        "check:next-config-surface",
        "check:dependabot-config",
        "check:vercel-cron",
        "check:env-matrix",
        "check:e2e-env-matrix",
        "check:merge-queue-canary-parity",
        "check:artifact-json-matrix",
        "check:artifact-integrity",
        "check:e2e-po-route-coverage",
        "check:qa-injection-class-matrix",
        "check:jurisdiction-artifact-coverage",
        "check:absent-protocol-evidence",
        "check:ofac-screening-stub-parity",
        "check:robots-crawler-policy",
        "check:reporting-endpoints",
        "check:pen-test-findings-closure",
        "check:subprocessor-change-sla",
        "check:src-tree-coverage",
        "check:pr-body-json",
        "check:api-problem-json",
        "check:api-sunset-deprecation",
        "check:sharp-svgo-versions",
        "check:suppress-hydration-warning",
        "check:kyb-beneficial-owner-schema",
        "check:rebuild-v10-read-models-nightly-gate",
        "check:eslint-custom-rules-optional",
        "test:scripts",
        "test:integration:ai-webhook",
        "security:sweep:comprehensive",
        "perf:sweep:quarterly",
        "test:e2e:ui-qa-plan",
        "test:e2e:adversarial",
        "test:e2e:resilience:all",
        "test:vitest:v10",
        "report:test-heatmap",
        { "script": "check:openapi-contract-smoke", "required": true, "ifEnv": "STAGING_BASE_URL" },
        { "script": "test:staging-env-parity", "required": true, "ifEnv": "STAGING_BASE_URL" },
        { "script": "test:rls-smoke", "required": true, "ifEnv": "RLS_SMOKE_STRICT" },
        { "script": "test:lighthouse:nightly", "required": true, "ifEnv": "RUN_LIGHTHOUSE_NIGHTLY" },
        { "script": "test:synthetic-p0", "required": true, "ifEnv": "STAGING_BASE_URL" },
        { "script": "test:slo-budgets", "required": true, "ifEnv": "STAGING_BASE_URL" },
        { "script": "check:synthetic-slo-env", "required": true, "ifEnv": "SYNTHETIC_STRICT" },
        { "script": "security:semgrep:full", "required": true, "ifEnv": "SEMGREP_FULL" },
        { "script": "report:sbom-diff-stub", "required": true, "ifEnv": "SBOM_DIFF_STRICT" },
        { "script": "dns-caa-smoke", "required": true, "ifEnv": "DOMAIN_STRICT" },
        { "script": "dnssec-privacy-smoke", "required": true, "ifEnv": "DNSSEC_PRIVACY_STRICT" },
        { "script": "cert-expiry-smoke", "required": true, "ifEnv": "CERT_STRICT" },
        { "script": "readability-smoke", "required": true, "ifEnv": "READABILITY_STRICT" },
        { "script": "email-auth-dns-smoke", "required": true, "ifEnv": "EMAIL_DNS_STRICT" },
        { "script": "verify-cosign-artifact", "required": true, "ifEnv": "COSIGN_PUBLIC_KEY" },
        { "script": "verify-slsa-attestation", "required": true, "ifEnv": "SLSA_VERIFY_STRICT" },
        { "script": "check:dr-drill-smoke", "required": true, "ifEnv": "DR_DRILL_STRICT" },
        { "script": "report:knip-supply-chain-stub", "required": true, "ifEnv": "SUPPLY_CHAIN_STUB_REPORT" },
        { "script": "report:jscpd-supply-chain-stub", "required": true, "ifEnv": "SUPPLY_CHAIN_STUB_REPORT" },
        { "script": "report:carbon-wallclock-stub", "required": true, "ifEnv": "CARBON_RUNTIME_REPORT" },
        { "script": "check:k8s-conftest-stub", "required": true, "ifEnv": "K8S_POLICY_STRICT" }
      ]
    },
    "nightly_deep": {
      "mergeAutodiscoverChecks": false,
      "steps": [
        "report:qa-coverage-tier",
        "qa:sweep:max:p4",
        "pipeline:ci-parity",
        "check:command-reference-integrity",
        "license:allowlist-verify",
        "verify:ofac-sample-hash",
        "check:qa-workflow-fleet",
        "check:next-config-surface",
        "check:dependabot-config",
        "check:vercel-cron",
        "check:env-matrix",
        "check:e2e-env-matrix",
        "check:merge-queue-canary-parity",
        "check:artifact-json-matrix",
        "check:artifact-integrity",
        "check:e2e-po-route-coverage",
        "check:qa-injection-class-matrix",
        "check:jurisdiction-artifact-coverage",
        "check:absent-protocol-evidence",
        "check:ofac-screening-stub-parity",
        "check:robots-crawler-policy",
        "check:reporting-endpoints",
        "check:pen-test-findings-closure",
        "check:subprocessor-change-sla",
        "check:src-tree-coverage",
        "check:pr-body-json",
        "check:api-problem-json",
        "check:api-sunset-deprecation",
        "check:sharp-svgo-versions",
        "check:suppress-hydration-warning",
        "check:kyb-beneficial-owner-schema",
        "check:rebuild-v10-read-models-nightly-gate",
        "check:eslint-custom-rules-optional",
        "test:scripts",
        "test:integration:ai-webhook",
        "security:sweep:comprehensive",